OrderID,ProductName,Discount,Sales,Profit,Quantity,SubCategory
AZ-2012-2921507,"OFS-Green Bar Cards & Envelopes, Recycled",0,$338.00,$37.00,7,Paper
AZ-2012-2921507,"TECH-Enermax Mouse, Erganomic",0,$114.00,$8.00,3,Accessories
AZ-2012-9538044,"TECH-HP Fax and Copier, Color",0,$349.00,$143.00,2,Copiers
BN-2012-8539408,"OFS-Hamilton Beach Microwave, Silver",0.1,$510.00,-$40.00,2,Appliances
AZ-2012-6620882,"OFS-BIC Pencil Sharpener, Easy-Erase",0,$117.00,$6.00,4,Art
AZ-2012-6620882,"OFS-Avery Hole Reinforcements, Recycled",0,$10.00,$4.00,2,Binders
AZ-2012-6620882,"OFS-Stockwell Push Pins, Bulk Pack",0,$43.00,$9.00,3,Fasteners
AZ-2012-6569540,"FUR-Sauder Library with Doors, Traditional",0,"$2,713.00",$27.00,7,Bookcases
AZ-2012-9487652,"FUR-Sauder Library with Doors, Traditional",0,"$1,163.00",$12.00,3,Bookcases
AZ-2012-9487652,"OFS-Breville Refrigerator, Silver",0,"$2,080.00",$562.00,4,Appliances
AZ-2012-9487652,"OFS-Avery 3-Hole Punch, Recycled",0,$85.00,$0.00,3,Binders
AZ-2012-9487652,"OFS-Rogers Lockers, Blue",0.1,$571.00,-$19.00,3,Storage
AZ-2012-9487652,"TECH-Apple Signal Booster, with Caller ID",0.1,$123.00,-$1.00,1,Phones
AZ-2012-9487652,"TECH-Cisco Signal Booster, with Caller ID",0.1,$547.00,$91.00,4,Phones
AZ-2012-9364026,"OFS-Ibico Index Tab, Clear",0,$62.00,$11.00,7,Binders
AZ-2012-9364026,"OFS-Acme Ruler, High Speed",0,$50.00,$2.00,3,Supplies
AZ-2012-8617894,"OFS-Sanford Canvas, Fluorescent",0,$207.00,$77.00,4,Art
AZ-2012-8617894,"OFS-Elite Box Cutter, Easy Grip",0,$110.00,$16.00,3,Supplies
AZ-2012-5310150,"OFS-Tenex Shelving, Industrial",0,$55.00,$10.00,1,Storage
BN-2012-3780400,"FUR-Hon Executive Leather Armchair, Adjustable",0.2,$728.00,-$82.00,2,Chairs
BN-2012-3780400,"OFS-KitchenAid Blender, Silver",0,$297.00,$104.00,3,Appliances
AZ-2012-3446417,"OFS-Eldon Box, Wire Frame",0,$47.00,$15.00,5,Storage
AZ-2012-8512121,"FUR-Eldon Door Stop, Black",0,$100.00,$19.00,2,Furnishings
AZ-2012-4689385,"OFS-Cardinal Index Tab, Durable",0,$15.00,$7.00,2,Binders
AZ-2012-50424,"OFS-Sanford Sketch Pad, Easy-Erase",0,$137.00,$63.00,3,Art
AZ-2012-50424,"OFS-GlobeWeis Business Envelopes, Recycled",0,$32.00,$14.00,2,Envelopes
BN-2012-1800160,"OFS-Fellowes Shelving, Single Width",0.4,$69.00,-$16.00,2,Storage
AZ-2012-3965327,"OFS-GlobeWeis Clasp Envelope, Set of 50",0,$79.00,$32.00,8,Envelopes
AZ-2012-358335,"OFS-Stanley Highlighters, Easy-Erase",0,$15.00,$5.00,1,Art
AZ-2012-358335,"OFS-Fellowes Trays, Wire Frame",0.4,$68.00,-$17.00,2,Storage
AZ-2012-9982238,"OFS-Accos Push Pins, Metal",0,$73.00,$12.00,5,Fasteners
AZ-2012-9982238,"TECH-Brother Personal Copier, High-Speed",0.15,$360.00,$30.00,3,Copiers
AZ-2012-9503430,"FUR-Hon Executive Leather Armchair, Adjustable",0.1,$827.00,$156.00,2,Chairs
AZ-2012-9503430,"OFS-Ibico Index Tab, Clear",0.1,$24.00,$2.00,3,Binders
AZ-2012-9503430,"TECH-SanDisk Mouse, Bluetooth",0.1,$103.00,$1.00,3,Accessories
AZ-2012-2712293,"OFS-Boston Canvas, Easy-Erase",0,$323.00,$74.00,6,Art
AZ-2012-2712293,"OFS-Stanley Pencil Sharpener, Water Color",0,$225.00,$14.00,9,Art
BN-2012-716723,"FUR-Rubbermaid Frame, Duo Pack",0,$220.00,$24.00,2,Furnishings
BN-2012-716723,"OFS-Stanley Canvas, Fluorescent",0,$203.00,$65.00,4,Art
BN-2012-716723,"TECH-Sharp Fax Machine, Color",0.15,$758.00,-$62.00,3,Copiers
AZ-2012-2293554,"OFS-Eldon Shelving, Single Width",0,$97.00,$0.00,2,Storage
AZ-2012-7998703,"OFS-Binney & Smith Sketch Pad, Blue",0,$371.00,$96.00,8,Art
AZ-2012-7998703,"OFS-SanDisk Cards & Envelopes, Recycled",0,$97.00,$4.00,2,Paper
AZ-2012-1979551,"OFS-Breville Toaster, Red",0.1,$69.00,$18.00,1,Appliances
AZ-2012-1979551,"TECH-Apple Signal Booster, with Caller ID",0,$683.00,$61.00,5,Phones
AZ-2012-2580887,"OFS-Binney & Smith Pencil Sharpener, Water Color",0,$209.00,$48.00,7,Art
AZ-2012-2580887,"OFS-Enermax Parchment Paper, 8.5 x 11",0,$117.00,$33.00,6,Paper
AZ-2012-2580887,"OFS-Tenex Box, Wire Frame",0.1,$42.00,$17.00,3,Storage
AZ-2012-4640221,"TECH-Hewlett Wireless Fax, High-Speed",0,"$1,514.00",$742.00,4,Copiers
AZ-2012-5752966,"TECH-Nokia Smart Phone, Full Size",0,"$5,725.00","$2,461.00",9,Phones
AZ-2012-2449827,"OFS-Stanley Highlighters, Water Color",0,$54.00,$18.00,3,Art
AZ-2012-2449827,"OFS-Avery Index Tab, Clear",0,$25.00,$1.00,4,Binders
AZ-2012-2449827,"TECH-Okidata Receipt Printer, Wireless",0.1,$442.00,$84.00,4,Machines
BN-2012-7258485,"OFS-Stockwell Staples, 12 Pack",0.5,$25.00,-$6.00,5,Fasteners
BN-2012-1349610,"FUR-Bevis Conference Table, Fully Assembled",0.85,$555.00,"-$1,925.00",4,Tables
AZ-2012-3506713,"OFS-Binney & Smith Markers, Easy-Erase",0,$122.00,$49.00,5,Art
AZ-2012-3506713,"OFS-Eaton Message Books, Recycled",0,$102.00,$14.00,5,Paper
AZ-2012-9615606,"OFS-Acco Hole Reinforcements, Durable",0,$65.00,$30.00,8,Binders
AZ-2012-9615606,"OFS-Novimex Round Labels, 5000 Label Set",0,$13.00,$6.00,2,Labels
AZ-2012-9385706,"TECH-Logitech Numeric Keypad, Erganomic",0,$44.00,$18.00,1,Accessories
AZ-2012-9385706,"TECH-Samsung Smart Phone, VoIP",0,"$1,909.00",$57.00,3,Phones
AZ-2012-5106565,"OFS-Acco Index Tab, Economy",0.5,$10.00,-$1.00,2,Binders
AZ-2012-9291301,"OFS-Binney & Smith Pens, Water Color",0,$45.00,$16.00,3,Art
AZ-2012-8028235,"TECH-Canon Wireless Fax, High-Speed",0,$377.00,$98.00,1,Copiers
AZ-2012-3249580,"FUR-Ikea Library with Doors, Pine",0.1,"$1,970.00",$503.00,6,Bookcases
AZ-2012-3249580,"OFS-Stanley Pens, Fluorescent",0,$34.00,$3.00,3,Art
AZ-2012-6550286,"OFS-Fiskars Scissors, Serrated",0,$79.00,$36.00,4,Supplies
AZ-2012-6550286,"TECH-Konica Receipt Printer, Durable",0.15,$312.00,$51.00,3,Machines
AZ-2012-2445606,"OFS-Sanford Canvas, Easy-Erase",0,$102.00,$13.00,2,Art
AZ-2012-5539179,"OFS-Fellowes Box, Wire Frame",0.1,$34.00,$13.00,2,Storage
AZ-2012-3229399,"OFS-Advantus Paper Clips, Metal",0,$54.00,$13.00,4,Fasteners
AZ-2012-3229399,"OFS-Fellowes Folders, Industrial",0.1,$24.00,$3.00,1,Storage
AZ-2012-3380048,"FUR-Harbour Creations Chairmat, Set of Two",0.1,$134.00,$4.00,2,Chairs
AZ-2012-3380048,"OFS-Sanford Pens, Water Color",0,$43.00,$20.00,3,Art
AZ-2012-8456579,"FUR-Novimex Chairmat, Adjustable",0.1,$265.00,$82.00,5,Chairs
AZ-2012-8456579,"OFS-Enermax Memo Slips, Premium",0,$31.00,$1.00,2,Paper
AZ-2012-9884785,"OFS-Ames Mailers, Security-Tint",0,$230.00,$21.00,6,Envelopes
AZ-2012-8884633,"OFS-Avery Binding Machine, Recycled",0,$98.00,$42.00,2,Binders
AZ-2012-768602,"OFS-Cameo Clasp Envelope, Security-Tint",0,$36.00,$9.00,3,Envelopes
AZ-2012-7477983,"FUR-Advantus Frame, Durable",0,$973.00,$107.00,9,Furnishings
AZ-2012-7477983,"OFS-Acco Index Tab, Clear",0,$16.00,$7.00,2,Binders
AZ-2012-7477983,"OFS-Cameo Business Envelopes, Recycled",0,$77.00,$8.00,4,Envelopes
AZ-2012-5575176,"FUR-Advantus Light Bulb, Black",0,$40.00,$19.00,2,Furnishings
AZ-2012-4828217,"OFS-Sanford Canvas, Blue",0,$152.00,$44.00,3,Art
AZ-2012-6744680,"OFS-Stockwell Staples, Assorted Sizes",0,$58.00,$25.00,7,Fasteners
AZ-2012-6744680,"OFS-Novimex Legal Exhibit Labels, Laser Printer Compatible",0,$21.00,$7.00,2,Labels
AZ-2012-5610095,"OFS-Harbour Creations Removable Labels, Adjustable",0.1,$37.00,$2.00,5,Labels
AZ-2012-2860153,"TECH-Apple Audio Dock, with Caller ID",0,$501.00,$75.00,3,Phones
AZ-2012-6992927,"OFS-Cameo Interoffice Envelope, Recycled",0,$92.00,$39.00,2,Envelopes
AZ-2012-6992927,"OFS-Smead Folders, Blue",0,$35.00,$4.00,2,Storage
BN-2012-6756198,"OFS-Rogers File Cart, Single Width",0.4,$510.00,-$119.00,6,Storage
AZ-2012-385874,"OFS-Boston Pens, Water Color",0,$52.00,$5.00,3,Art
AZ-2012-51069,"OFS-Tenex Trays, Single Width",0.1,$146.00,$46.00,3,Storage
AZ-2012-1968371,"OFS-Binney & Smith Markers, Easy-Erase",0,$97.00,$39.00,4,Art
AZ-2012-1968371,"OFS-Binney & Smith Sketch Pad, Water Color",0,$149.00,$49.00,3,Art
AZ-2012-1968371,"OFS-Boston Pens, Water Color",0,$104.00,$9.00,6,Art
AZ-2012-1968371,"TECH-HP Fax Machine, High-Speed",0,"$1,491.00",$74.00,5,Copiers
AZ-2012-7344517,"OFS-Fiskars Letter Opener, High Speed",0,$55.00,$2.00,2,Supplies
BN-2012-26008,"FUR-Office Star Bag Chairs, Black",0.5,$159.00,-$29.00,6,Chairs
BN-2012-26008,"OFS-OIC Paper Clips, Assorted Sizes",0.5,$12.00,-$6.00,2,Fasteners
BN-2012-26008,"OFS-Enermax Memo Slips, Recycled",0.5,$8.00,-$5.00,1,Paper
BN-2012-26008,"OFS-Enermax Note Cards, Premium",0.5,$60.00,-$35.00,4,Paper
BN-2012-26008,"TECH-Nokia Speaker Phone, Full Size",0.5,$249.00,-$149.00,4,Phones
AZ-2012-7800585,"FUR-Safco Floating Shelf Set, Pine",0.1,$357.00,$20.00,2,Bookcases
AZ-2012-5071313,"OFS-Stanley Pens, Water Color",0,$53.00,$17.00,4,Art
AZ-2012-6341558,"OFS-Binney & Smith Pens, Water Color",0,$30.00,$11.00,2,Art
AZ-2012-6341558,"OFS-Tenex File Cart, Industrial",0,$402.00,$76.00,3,Storage
AZ-2012-7094138,"OFS-Eldon Shelving, Blue",0.1,$87.00,$16.00,2,Storage
BN-2012-8691355,"TECH-Samsung Signal Booster, with Caller ID",0.5,$341.00,-$341.00,5,Phones
BN-2012-6248125,"FUR-Office Star Steel Folding Chair, Red",0.5,$183.00,-$140.00,4,Chairs
BN-2012-6248125,"OFS-Wilson Jones Binder, Recycled",0.5,$47.00,-$11.00,7,Binders
BN-2012-4716466,"OFS-Eldon Box, Single Width",0,$21.00,$6.00,2,Storage
BN-2012-3975378,"FUR-Novimex Bag Chairs, Set of Two",0.6,$96.00,-$87.00,5,Chairs
AZ-2012-7754388,"OFS-Eldon Lockers, Industrial",0.1,$714.00,$309.00,4,Storage
BN-2012-3975378,"OFS-Eldon File Cart, Single Width",0.4,$154.00,$8.00,2,Storage
BN-2012-3975378,"OFS-Rogers Trays, Blue",0.4,$37.00,-$6.00,1,Storage
AZ-2012-7754388,"TECH-Hewlett Fax Machine, Laser",0,$320.00,$16.00,1,Copiers
AZ-2012-1667717,"OFS-Stanley Pencil Sharpener, Water Color",0,$84.00,$3.00,3,Art
AZ-2012-8270479,"TECH-Logitech Keyboard, Erganomic",0,$492.00,$44.00,7,Accessories
AZ-2012-8270479,"TECH-Motorola Office Telephone, Full Size",0.15,$373.00,$74.00,6,Phones
AZ-2012-5209012,"OFS-Ibico Binder Covers, Clear",0,$92.00,$6.00,7,Binders
AZ-2012-5209012,"OFS-Harbour Creations Round Labels, Alphabetical",0,$59.00,$23.00,9,Labels
AZ-2012-5209012,"OFS-Eldon Folders, Single Width",0.1,$61.00,$25.00,4,Storage
AZ-2012-5209012,"OFS-Smead Shelving, Wire Frame",0.1,$130.00,$52.00,3,Storage
AZ-2012-5209012,"OFS-Acme Box Cutter, High Speed",0,$113.00,$54.00,3,Supplies
AZ-2012-5209012,"TECH-Logitech Numeric Keypad, Erganomic",0,$397.00,$163.00,9,Accessories
AZ-2012-2145523,"OFS-Smead Box, Single Width",0.1,$39.00,$7.00,4,Storage
AZ-2012-4858195,"OFS-Stanley Pencil Sharpener, Water Color",0,$28.00,$1.00,1,Art
AZ-2012-4858195,"OFS-Acco 3-Hole Punch, Economy",0,$90.00,$17.00,3,Binders
AZ-2012-4858195,"TECH-Belkin Memory Card, Bluetooth",0,$230.00,$50.00,2,Accessories
AZ-2012-4858195,"TECH-Logitech Router, Erganomic",0,$981.00,$176.00,4,Accessories
BN-2012-9976090,"FUR-Office Star Bag Chairs, Black",0.5,$27.00,-$5.00,1,Chairs
AZ-2012-4642183,"OFS-Fellowes File Cart, Industrial",0.1,$248.00,$8.00,2,Storage
BN-2012-9976090,"OFS-Acco Binder Covers, Durable",0.5,$37.00,-$4.00,5,Binders
BN-2012-9976090,"TECH-Apple Headset, with Caller ID",0.5,$73.00,-$51.00,2,Phones
BN-2012-834682,"OFS-Boston Sketch Pad, Easy-Erase",0.5,$49.00,-$21.00,2,Art
AZ-2012-6682844,"OFS-Xerox Cards & Envelopes, Recycled",0,$135.00,$43.00,3,Paper
AZ-2012-6682844,"OFS-Fellowes Box, Wire Frame",0.4,$56.00,$6.00,5,Storage
BN-2012-834682,"TECH-Memorex Numeric Keypad, USB",0.5,$86.00,-$29.00,4,Accessories
AZ-2012-5685113,"OFS-Cameo Clasp Envelope, Security-Tint",0,$36.00,$9.00,3,Envelopes
AZ-2012-252256,"FUR-Bush Library with Doors, Metal",0,"$2,546.00",$382.00,7,Bookcases
AZ-2012-3045764,"OFS-Cardinal Hole Reinforcements, Clear",0,$24.00,$11.00,5,Binders
AZ-2012-252256,"OFS-Jiffy Business Envelopes, Security-Tint",0,$48.00,$3.00,3,Envelopes
AZ-2012-252256,"OFS-Fellowes Trays, Blue",0.4,$138.00,-$76.00,4,Storage
AZ-2012-252256,"OFS-Acme Scissors, Easy Grip",0,$108.00,$26.00,4,Supplies
AZ-2012-252256,"OFS-Stiletto Ruler, Serrated",0,$46.00,$15.00,4,Supplies
AZ-2012-2467107,"FUR-Hon Rocking Chair, Adjustable",0.1,$120.00,$51.00,1,Chairs
AZ-2012-2467107,"FUR-Barricks Conference Table, Adjustable Height",0.35,"$2,364.00",-$218.00,4,Tables
AZ-2012-2467107,"OFS-Novimex Shipping Labels, Alphabetical",0,$43.00,$22.00,4,Labels
AZ-2012-2961412,"FUR-Deflect-O Stacking Tray, Durable",0.3,$53.00,-$19.00,3,Furnishings
AZ-2012-2961412,"OFS-Ames Interoffice Envelope, Security-Tint",0,$95.00,$47.00,2,Envelopes
AZ-2012-2961412,"TECH-HP Fax Machine, Laser",0,$900.00,$360.00,3,Copiers
AZ-2012-2961412,"TECH-Motorola Signal Booster, VoIP",0,$716.00,$36.00,5,Phones
AZ-2012-564106,"OFS-Fellowes Trays, Wire Frame",0.1,$152.00,$25.00,3,Storage
AZ-2012-564106,"TECH-Hewlett Copy Machine, Color",0,$530.00,$180.00,2,Copiers
AZ-2012-564106,"TECH-Sharp Copy Machine, Laser",0,$717.00,$93.00,3,Copiers
AZ-2012-564106,"TECH-Motorola Office Telephone, Full Size",0,$365.00,$117.00,5,Phones
AZ-2012-534231,"FUR-Hon Steel Folding Chair, Set of Two",0,$586.00,$123.00,7,Chairs
AZ-2012-534231,"OFS-Sanford Markers, Water Color",0,$79.00,$7.00,3,Art
AZ-2012-534231,"OFS-Cameo Clasp Envelope, Security-Tint",0,$36.00,$9.00,3,Envelopes
AZ-2012-5605130,"OFS-Hamilton Beach Stove, Silver",0.1,"$2,444.00",$760.00,5,Appliances
AZ-2012-5605130,"OFS-Binney & Smith Pens, Easy-Erase",0,$12.00,$0.00,1,Art
AZ-2012-5605130,"OFS-Hon Color Coded Labels, Alphabetical",0,$25.00,$0.00,2,Labels
AZ-2012-5605130,"OFS-Rogers Folders, Blue",0.1,$138.00,-$12.00,5,Storage
AZ-2012-5605130,"TECH-Samsung Smart Phone, Full Size",0.15,"$2,167.00",$790.00,4,Phones
AZ-2012-2772170,"OFS-Wilson Jones 3-Hole Punch, Recycled",0,$198.00,$59.00,7,Binders
AZ-2012-9269920,"FUR-Deflect-O Clock, Durable",0,$142.00,$45.00,3,Furnishings
AZ-2012-9269920,"FUR-Eldon Door Stop, Duo Pack",0,$151.00,$47.00,3,Furnishings
AZ-2012-9269920,"OFS-Ibico Hole Reinforcements, Clear",0,$13.00,$5.00,2,Binders
AZ-2012-9269920,"OFS-Tenex Shelving, Single Width",0.1,$49.00,$8.00,1,Storage
AZ-2012-9269920,"OFS-Kleencut Scissors, Steel",0,$43.00,$3.00,2,Supplies
AZ-2012-8935419,"OFS-Novimex File Folder Labels, Alphabetical",0,$24.00,$3.00,3,Labels
AZ-2012-8935419,"TECH-Motorola Headset, Cordless",0,$248.00,$79.00,3,Phones
AZ-2012-8267693,"FUR-Harbour Creations Executive Leather Armchair, Adjustable",0.1,"$2,571.00",$857.00,6,Chairs
AZ-2012-19748,"FUR-Dania Classic Bookcase, Metal",0.1,"$2,584.00",$660.00,7,Bookcases
AZ-2012-1629233,"OFS-Acco Hole Reinforcements, Recycled",0,$21.00,$11.00,3,Binders
AZ-2012-910518,"OFS-Cardinal Binder Covers, Clear",0,$34.00,$9.00,3,Binders
BN-2012-9118529,"OFS-Advantus Paper Clips, Bulk Pack",0.5,$14.00,-$10.00,2,Fasteners
AZ-2012-910518,"TECH-Nokia Smart Phone, Full Size",0.15,"$1,081.00",$356.00,2,Phones
AZ-2012-5227678,"FUR-Safco Stackable Bookrack, Traditional",0,$297.00,$47.00,2,Bookcases
AZ-2012-3239511,"OFS-Hoover Toaster, White",0,$164.00,$57.00,2,Appliances
AZ-2012-1680064,"OFS-Stanley Highlighters, Fluorescent",0,$96.00,$35.00,6,Art
AZ-2012-1472059,"FUR-Dania Corner Shelving, Traditional",0,$610.00,$207.00,5,Bookcases
AZ-2012-1672161,"OFS-Harbour Creations Shipping Labels, 5000 Label Set",0,$24.00,$5.00,2,Labels
AZ-2012-1672161,"OFS-Tenex Shelving, Single Width",0.1,$49.00,$8.00,1,Storage
AZ-2012-9662305,"OFS-Stiletto Box Cutter, Steel",0,$212.00,$15.00,6,Supplies
AZ-2012-1472059,"TECH-Sharp Personal Copier, Laser",0,$120.00,$7.00,1,Copiers
AZ-2012-9180842,"OFS-Fiskars Shears, Steel",0,$94.00,$27.00,2,Supplies
AZ-2012-8926364,"OFS-Cardinal 3-Hole Punch, Economy",0,$144.00,$65.00,5,Binders
AZ-2012-8926364,"OFS-Kraft Interoffice Envelope, Security-Tint",0,$99.00,$10.00,2,Envelopes
AZ-2012-9627965,"OFS-Avery Binding Machine, Clear",0,$48.00,$6.00,1,Binders
AZ-2012-9627965,"OFS-Smead Trays, Single Width",0.1,$131.00,$32.00,3,Storage
AZ-2012-1714781,"FUR-Ikea Floating Shelf Set, Mobile",0.1,$467.00,-$26.00,3,Bookcases
AZ-2012-1714781,"TECH-HP Ink, High-Speed",0.15,$431.00,-$46.00,4,Copiers
AZ-2012-1714781,"TECH-StarTech Printer, Red",0.15,$646.00,$213.00,3,Machines
AZ-2012-1169269,"OFS-Elite Letter Opener, Easy Grip",0,$145.00,$7.00,5,Supplies
BN-2012-7150629,"FUR-Safco Library with Doors, Mobile",0.1,"$1,765.00",-$98.00,5,Bookcases
BN-2012-7150629,"OFS-KitchenAid Coffee Grinder, Red",0.1,$190.00,$15.00,3,Appliances
AZ-2012-5215986,"OFS-Cardinal 3-Hole Punch, Clear",0,$85.00,$18.00,3,Binders
BN-2012-7249062,"FUR-Advantus Door Stop, Duo Pack",0.3,$158.00,-$54.00,5,Furnishings
AZ-2012-9062597,"OFS-Eldon File Cart, Single Width",0.1,$345.00,$31.00,3,Storage
AZ-2012-569279,"TECH-Sharp Ink, Color",0.5,$189.00,-$11.00,3,Copiers
AZ-2012-9805086,"OFS-Avery Index Tab, Economy",0,$39.00,$16.00,5,Binders
AZ-2012-4114446,"OFS-Sanford Pens, Fluorescent",0.1,$22.00,$4.00,2,Art
AZ-2012-4114446,"OFS-Acco Binder, Clear",0.1,$39.00,$10.00,3,Binders
AZ-2012-3985988,"OFS-Stanley Pencil Sharpener, Water Color",0,$112.00,$4.00,4,Art
AZ-2012-3985988,"OFS-Acco Binder, Recycled",0,$124.00,$4.00,8,Binders
AZ-2012-3985988,"OFS-Ames Peel and Seal, with clear poly window",0,$89.00,$41.00,4,Envelopes
AZ-2012-3985988,"OFS-Advantus Rubber Bands, Bulk Pack",0,$17.00,$5.00,1,Fasteners
AZ-2012-3985988,"OFS-Eldon Folders, Single Width",0.4,$31.00,$4.00,3,Storage
AZ-2012-9624390,"FUR-Hon Bag Chairs, Adjustable",0,$333.00,$73.00,7,Chairs
AZ-2012-9624390,"TECH-Okidata Inkjet, Wireless",0,"$2,199.00",$923.00,7,Machines
AZ-2012-3603258,"OFS-Stanley Markers, Easy-Erase",0,$22.00,$0.00,1,Art
AZ-2012-3603258,"OFS-Smead Legal Exhibit Labels, Adjustable",0,$27.00,$4.00,3,Labels
AZ-2012-5304566,"OFS-Smead Box, Wire Frame",0.1,$18.00,$1.00,2,Storage
AZ-2012-5304566,"TECH-Apple Speaker Phone, Full Size",0,$125.00,$54.00,1,Phones
AZ-2012-5992799,"FUR-Hon Chairmat, Red",0.1,$150.00,$7.00,3,Chairs
AZ-2012-5992799,"TECH-Okidata Inkjet, White",0,$623.00,$81.00,2,Machines
AZ-2012-8255780,"OFS-Smead Shelving, Single Width",0.1,$88.00,$34.00,2,Storage
AZ-2012-6372701,"OFS-Wilson Jones Index Tab, Economy",0,$26.00,$7.00,4,Binders
AZ-2012-6372701,"OFS-Fellowes File Cart, Blue",0.1,$247.00,$82.00,2,Storage
AZ-2012-8255780,"TECH-Konica Phone, Red",0.15,$142.00,$45.00,2,Machines
AZ-2012-6372701,"TECH-Brother Copy Machine, Color",0.15,$673.00,$222.00,3,Copiers
BN-2012-702658,"OFS-Sanford Pencil Sharpener, Water Color",0.5,$15.00,-$11.00,1,Art
AZ-2012-5235693,"TECH-Nokia Office Telephone, VoIP",0,$196.00,$72.00,3,Phones
AZ-2012-7930986,"FUR-Hon Executive Leather Armchair, Black",0.1,$823.00,$247.00,2,Chairs
AZ-2012-7930986,"OFS-Fiskars Scissors, Steel",0.1,$284.00,$123.00,14,Supplies
AZ-2012-1696586,"OFS-Wilson Jones 3-Hole Punch, Clear",0,$82.00,$23.00,3,Binders
BN-2012-7504566,"OFS-Sanford Pencil Sharpener, Water Color",0.5,$39.00,-$19.00,3,Art
AZ-2012-2224198,"OFS-Stockwell Paper Clips, Bulk Pack",0,$41.00,$20.00,3,Fasteners
AZ-2012-2224198,"TECH-SanDisk Memory Card, Bluetooth",0,$225.00,$29.00,2,Accessories
AZ-2012-8940474,"FUR-Novimex Chairmat, Set of Two",0,$293.00,$47.00,5,Chairs
AZ-2012-8940474,"OFS-Stanley Canvas, Easy-Erase",0,$99.00,$24.00,2,Art
AZ-2012-2500695,"OFS-Kraft Business Envelopes, Set of 50",0,$60.00,$29.00,3,Envelopes
AZ-2012-8940474,"TECH-Motorola Office Telephone, VoIP",0,$216.00,$95.00,3,Phones
AZ-2012-2500695,"TECH-Motorola Headset, Cordless",0.1,$446.00,$109.00,6,Phones
AZ-2012-3373330,"FUR-SAFCO Rocking Chair, Adjustable",0.2,$769.00,$154.00,7,Chairs
AZ-2012-3373330,"FUR-Eldon Clock, Duo Pack",0.1,$153.00,$58.00,3,Furnishings
AZ-2012-3373330,"OFS-Sanford Pens, Water Color",0.1,$64.00,$26.00,5,Art
AZ-2012-3373330,"OFS-Avery Index Tab, Clear",0.1,$16.00,$3.00,3,Binders
AZ-2012-3373330,"OFS-Ibico Index Tab, Clear",0.1,$56.00,$5.00,7,Binders
AZ-2012-3373330,"OFS-Smead Folders, Wire Frame",0.2,$53.00,-$9.00,4,Storage
BN-2012-8400051,"OFS-Hon Round Labels, Laser Printer Compatible",0.5,$3.00,-$1.00,1,Labels
AZ-2012-1999567,"OFS-Fellowes Lockers, Single Width",0.1,$560.00,$44.00,3,Storage
AZ-2012-3373330,"TECH-Brother Fax and Copier, Digital",0.1,$344.00,$15.00,2,Copiers
BN-2012-7073852,"FUR-Hon Rocking Chair, Red",0.2,$522.00,-$78.00,5,Chairs
AZ-2012-4709370,"OFS-Ibico 3-Hole Punch, Economy",0,$91.00,$46.00,3,Binders
AZ-2012-4709370,"OFS-OIC Thumb Tacks, Assorted Sizes",0,$35.00,$14.00,3,Fasteners
AZ-2012-4709370,"OFS-Hon Shipping Labels, 5000 Label Set",0,$24.00,$11.00,2,Labels
AZ-2012-4709370,"OFS-Tenex File Cart, Single Width",0.4,$241.00,-$125.00,3,Storage
AZ-2012-1418024,"FUR-Ikea 3-Shelf Cabinet, Traditional",0,$712.00,$320.00,5,Bookcases
AZ-2012-1418024,"FUR-Bevis Wood Table, Rectangular",0,"$1,062.00",$181.00,2,Tables
AZ-2012-1418024,"OFS-Binney & Smith Canvas, Fluorescent",0,$158.00,$30.00,3,Art
AZ-2012-1418024,"TECH-SanDisk Mouse, Bluetooth",0,$230.00,$25.00,6,Accessories
AZ-2012-1418024,"TECH-Nokia Headset, Cordless",0,$380.00,$84.00,5,Phones
AZ-2012-219498,"OFS-Binney & Smith Pencil Sharpener, Water Color",0,$269.00,$62.00,9,Art
BN-2012-2362845,"FUR-Dania 3-Shelf Cabinet, Mobile",0.1,$907.00,-$30.00,7,Bookcases
AZ-2012-364031,"OFS-Acco Binder, Economy",0,$30.00,$4.00,2,Binders
AZ-2012-5139893,"TECH-Panasonic Inkjet, Durable",0.15,"$2,123.00",$125.00,8,Machines
AZ-2012-6962092,"OFS-Advantus Rubber Bands, Bulk Pack",0,$66.00,$22.00,4,Fasteners
AZ-2012-6962092,"OFS-Smead Shelving, Blue",0,$147.00,$44.00,3,Storage
AZ-2012-4686001,"OFS-Ames Peel and Seal, Security-Tint",0.1,$57.00,$13.00,3,Envelopes
AZ-2012-4686001,"OFS-Stockwell Clamps, Assorted Sizes",0.1,$29.00,$8.00,2,Fasteners
AZ-2012-9208057,"OFS-Cuisinart Refrigerator, Red",0,"$1,488.00",$372.00,3,Appliances
AZ-2012-9208057,"OFS-Cameo Clasp Envelope, Security-Tint",0,$24.00,$6.00,2,Envelopes
AZ-2012-9208057,"OFS-Tenex Box, Blue",0,$99.00,$25.00,6,Storage
AZ-2012-2839783,"OFS-BIC Pencil Sharpener, Fluorescent",0.1,$27.00,$7.00,1,Art
AZ-2012-2839783,"OFS-GlobeWeis Peel and Seal, with clear poly window",0.1,$45.00,-$3.00,2,Envelopes
AZ-2012-2839783,"OFS-Xerox Message Books, Premium",0.1,$55.00,$22.00,3,Paper
AZ-2012-9551282,"OFS-Sanford Markers, Easy-Erase",0,$165.00,$3.00,7,Art
AZ-2012-9551282,"OFS-Stanley Sketch Pad, Fluorescent",0,$46.00,$7.00,1,Art
AZ-2012-9551282,"TECH-Memorex Memory Card, Programmable",0,$519.00,$73.00,5,Accessories
AZ-2012-2413231,"OFS-Tenex Trays, Single Width",0.1,$98.00,$30.00,2,Storage
AZ-2012-7806726,"FUR-Tenex Photo Frame, Erganomic",0,$353.00,$7.00,7,Furnishings
AZ-2012-7806726,"OFS-BIC Sketch Pad, Easy-Erase",0,$343.00,$171.00,7,Art
AZ-2012-3093353,"FUR-Harbour Creations Steel Folding Chair, Red",0.1,$352.00,$67.00,4,Chairs
AZ-2012-3906554,"FUR-Harbour Creations Chairmat, Red",0.1,$518.00,$63.00,8,Chairs
AZ-2012-1028247,"OFS-Hamilton Beach Stove, Red",0.1,"$1,952.00",$759.00,4,Appliances
AZ-2012-3093353,"OFS-Wilson Jones Binder Covers, Recycled",0,$35.00,$8.00,3,Binders
AZ-2012-3093353,"OFS-OIC Push Pins, Bulk Pack",0,$15.00,$3.00,1,Fasteners
AZ-2012-3093353,"OFS-Avery Legal Exhibit Labels, Laser Printer Compatible",0,$23.00,$3.00,2,Labels
AZ-2012-3981098,"OFS-Acco Binder, Durable",0,$33.00,$9.00,2,Binders
AZ-2012-5060433,"FUR-Office Star Rocking Chair, Adjustable",0.1,$258.00,$75.00,2,Chairs
AZ-2012-5060433,"FUR-Eldon Clock, Duo Pack",0,$226.00,$99.00,4,Furnishings
AZ-2012-5060433,"OFS-Stiletto Letter Opener, Steel",0,$75.00,$9.00,3,Supplies
BN-2012-3187159,"OFS-Sanford Canvas, Blue",0.5,$51.00,-$21.00,2,Art
AZ-2012-9314178,"OFS-Cardinal Index Tab, Durable",0,$15.00,$7.00,2,Binders
AZ-2012-2363041,"OFS-Stockwell Paper Clips, Bulk Pack",0.5,$14.00,-$1.00,2,Fasteners
AZ-2012-8819621,"TECH-Samsung Signal Booster, VoIP",0.1,$246.00,$66.00,2,Phones
AZ-2012-3913480,"FUR-Eldon Frame, Durable",0,$906.00,$235.00,8,Furnishings
AZ-2012-3913480,"OFS-Boston Canvas, Water Color",0,$398.00,$60.00,7,Art
AZ-2012-3913480,"OFS-Cardinal Binding Machine, Clear",0,$345.00,$138.00,7,Binders
AZ-2012-2425717,"OFS-Ibico Binder Covers, Durable",0,$30.00,$4.00,2,Binders
AZ-2012-2425717,"OFS-Acme Scissors, Serrated",0,$66.00,$4.00,3,Supplies
AZ-2012-6757655,"OFS-Stockwell Staples, 12 Pack",0,$20.00,$6.00,2,Fasteners
AZ-2012-6757655,"OFS-Fellowes Folders, Wire Frame",0.1,$46.00,$8.00,2,Storage
AZ-2012-6757655,"OFS-Tenex Shelving, Wire Frame",0.1,$242.00,$5.00,5,Storage
BN-2012-3858400,"OFS-Wilson Jones Binding Machine, Recycled",0.5,$99.00,-$77.00,4,Binders
BN-2012-3858400,"OFS-Hon Removable Labels, Adjustable",0.5,$12.00,-$9.00,3,Labels
BN-2012-3858400,"OFS-Fiskars Trimmer, Serrated",0.5,$117.00,-$89.00,6,Supplies
AZ-2012-5894854,"OFS-Acco Binding Machine, Durable",0,$316.00,$76.00,6,Binders
AZ-2012-5894854,"OFS-Hon Shipping Labels, 5000 Label Set",0,$59.00,$28.00,5,Labels
AZ-2012-5894854,"OFS-Smead Shipping Labels, 5000 Label Set",0,$24.00,$1.00,2,Labels
AZ-2012-5894854,"OFS-Rogers Shelving, Industrial",0,$188.00,$56.00,3,Storage
AZ-2012-5894854,"OFS-Acme Letter Opener, Serrated",0,$54.00,$4.00,2,Supplies
AZ-2012-5894854,"OFS-Kleencut Ruler, Easy Grip",0,$46.00,$1.00,3,Supplies
AZ-2012-8565263,"TECH-Okidata Inkjet, White",0,"$1,245.00",$162.00,4,Machines
AZ-2012-5117204,"OFS-Acco 3-Hole Punch, Economy",0.1,$54.00,$5.00,2,Binders
BN-2012-5777866,"TECH-Hewlett Fax Machine, Laser",0.15,$816.00,-$96.00,3,Copiers
AZ-2012-5117204,"TECH-StarTech Inkjet, White",0.1,$807.00,$305.00,3,Machines
BN-2012-9869476,"TECH-Brother Wireless Fax, Digital",0,$757.00,$68.00,2,Copiers
BN-2012-9869476,"TECH-Motorola Audio Dock, Cordless",0.4,$211.00,-$49.00,2,Phones
BN-2012-1757975,"FUR-Harbour Creations Executive Leather Armchair, Black",0.1,$426.00,$90.00,1,Chairs
BN-2012-2095072,"OFS-GlobeWeis Manila Envelope, Security-Tint",0,$89.00,$1.00,3,Envelopes
BN-2012-2095072,"OFS-Kraft Peel and Seal, Set of 50",0,$41.00,$7.00,2,Envelopes
BN-2012-2095072,"OFS-Rogers Lockers, Wire Frame",0.1,$758.00,$126.00,4,Storage
AZ-2012-7448408,"OFS-Wilson Jones 3-Hole Punch, Durable",0.5,$15.00,-$9.00,1,Binders
AZ-2012-7448408,"OFS-Kraft Clasp Envelope, Set of 50",0.5,$5.00,-$5.00,1,Envelopes
AZ-2012-7448408,"OFS-Stockwell Push Pins, Metal",0.5,$22.00,-$21.00,3,Fasteners
