OrderID,ProductName,Discount,Sales,Profit,Quantity,SubCategory
AZ-2013-5539829,"FUR-Lesro Training Table, Adjustable Height",0.35,$176.00,$8.00,1,Tables
AZ-2013-5539829,"OFS-BIC Highlighters, Water Color",0,$88.00,$16.00,4,Art
AZ-2013-7570613,"FUR-Advantus Frame, Duo Pack",0,$222.00,$104.00,2,Furnishings
AZ-2013-7570613,"TECH-Apple Office Telephone, Full Size",0,$67.00,$29.00,1,Phones
AZ-2013-5029769,"OFS-Ibico Binding Machine, Durable",0,$159.00,$73.00,3,Binders
BN-2013-1382907,"FUR-Office Star Chairmat, Black",0.5,$127.00,-$56.00,4,Chairs
BN-2013-1382907,"TECH-Apple Signal Booster, with Caller ID",0.5,$273.00,-$224.00,4,Phones
AZ-2013-6450064,"OFS-Stanley Markers, Fluorescent",0,$47.00,$16.00,2,Art
AZ-2013-6450064,"OFS-Wilson Jones Binder Covers, Durable",0,$38.00,$17.00,3,Binders
BN-2013-6544742,"OFS-Binney & Smith Sketch Pad, Blue",0.5,$139.00,-$67.00,6,Art
AZ-2013-9861986,"OFS-Green Bar Cards & Envelopes, Multicolor",0,$249.00,$30.00,5,Paper
AZ-2013-1668042,"OFS-Hoover Stove, White",0,$567.00,$28.00,1,Appliances
AZ-2013-1668042,"OFS-Stanley Pencil Sharpener, Water Color",0,$140.00,$6.00,5,Art
AZ-2013-1668042,"OFS-Stockwell Thumb Tacks, Assorted Sizes",0,$44.00,$15.00,4,Fasteners
AZ-2013-5054484,"FUR-Office Star Steel Folding Chair, Adjustable",0.1,$509.00,$215.00,6,Chairs
AZ-2013-5054484,"FUR-Rubbermaid Frame, Black",0,$330.00,$125.00,3,Furnishings
AZ-2013-5054484,"TECH-Okidata Inkjet, White",0.15,"$2,910.00",-$69.00,11,Machines
BN-2013-2157928,"OFS-Eldon Folders, Industrial",0.4,$21.00,-$13.00,2,Storage
AZ-2013-1900588,"OFS-Eldon Shelving, Blue",0,$194.00,$52.00,4,Storage
AZ-2013-9730235,"OFS-Stanley Pencil Sharpener, Water Color",0,$75.00,$5.00,3,Art
AZ-2013-9730235,"TECH-Apple Headset, with Caller ID",0,$220.00,$33.00,3,Phones
AZ-2013-3680670,"OFS-Acco 3-Hole Punch, Durable",0,$348.00,$143.00,11,Binders
AZ-2013-3949241,"TECH-Apple Signal Booster, Cordless",0.65,$146.00,-$167.00,3,Phones
AZ-2013-9144577,"OFS-BIC Pencil Sharpener, Easy-Erase",0,$381.00,$19.00,13,Art
AZ-2013-9144577,"OFS-Kleencut Shears, Easy Grip",0,$97.00,$0.00,2,Supplies
AZ-2013-6417949,"FUR-Hon Swivel Stool, Black",0.1,$725.00,$145.00,5,Chairs
AZ-2013-6417949,"OFS-Cardinal Binder Covers, Clear",0,$92.00,$24.00,8,Binders
AZ-2013-6417949,"OFS-Cameo Mailers, Recycled",0,$148.00,$34.00,4,Envelopes
AZ-2013-6417949,"OFS-Smead Folders, Blue",0.1,$31.00,$1.00,2,Storage
AZ-2013-1527554,"OFS-Cardinal 3-Hole Punch, Recycled",0,$87.00,$25.00,3,Binders
AZ-2013-6417949,"TECH-Hewlett Wireless Fax, Laser",0,"$1,901.00",$589.00,5,Copiers
AZ-2013-6417949,"TECH-Cisco Smart Phone, Cordless",0,"$2,606.00","$1,042.00",4,Phones
AZ-2013-2266465,"OFS-Cardinal Binder Covers, Clear",0,$23.00,$6.00,2,Binders
BN-2013-8197561,"FUR-Hon Wood Table, Rectangular",0.35,"$1,031.00",-$317.00,3,Tables
BN-2013-2516957,"OFS-Tenex File Cart, Single Width",0.1,$121.00,-$1.00,1,Storage
AZ-2013-4238968,"TECH-Logitech Memory Card, Erganomic",0.5,$304.00,-$292.00,6,Accessories
BN-2013-5457641,"FUR-Eldon Clock, Durable",0.2,$43.00,$5.00,1,Furnishings
AZ-2013-4462556,"OFS-Xerox Memo Slips, Recycled",0,$40.00,$6.00,3,Paper
BN-2013-5457641,"OFS-Smead Removable Labels, Laser Printer Compatible",0.5,$15.00,-$6.00,3,Labels
AZ-2013-1244068,"OFS-Binney & Smith Canvas, Easy-Erase",0,$207.00,$35.00,4,Art
AZ-2013-1244068,"OFS-Acco 3-Hole Punch, Economy",0,$241.00,$46.00,8,Binders
AZ-2013-1244068,"TECH-Memorex Mouse, USB",0,$114.00,$21.00,4,Accessories
AZ-2013-2437220,"OFS-Avery Binder Covers, Recycled",0,$34.00,$12.00,3,Binders
AZ-2013-219349,"TECH-Enermax Keyboard, Bluetooth",0,$250.00,$120.00,3,Accessories
AZ-2013-2204444,"OFS-Eldon Folders, Single Width",0.4,$20.00,$2.00,2,Storage
AZ-2013-6937323,"OFS-Cameo Peel and Seal, with clear poly window",0,$49.00,$22.00,2,Envelopes
BN-2013-7528066,"FUR-Bush Classic Bookcase, Mobile",0.1,$374.00,-$21.00,1,Bookcases
BN-2013-7528066,"FUR-Novimex Chairmat, Adjustable",0.1,$106.00,$33.00,2,Chairs
BN-2013-7528066,"OFS-Sanford Highlighters, Blue",0,$63.00,$7.00,4,Art
BN-2013-7528066,"OFS-Acco Index Tab, Durable",0,$27.00,$6.00,3,Binders
BN-2013-7528066,"OFS-Cardinal Index Tab, Clear",0,$27.00,$11.00,4,Binders
BN-2013-7528066,"OFS-Wilson Jones Binding Machine, Durable",0,$101.00,$2.00,2,Binders
BN-2013-7528066,"TECH-Hewlett Personal Copier, Laser",0.15,$736.00,-$78.00,6,Copiers
BN-2013-7528066,"TECH-Panasonic Phone, White",0.15,$212.00,-$15.00,3,Machines
AZ-2013-8231031,"OFS-BIC Highlighters, Fluorescent",0,$40.00,$13.00,2,Art
AZ-2013-8231031,"OFS-Rogers File Cart, Single Width",0.4,$765.00,-$179.00,9,Storage
AZ-2013-8231031,"TECH-Memorex Flash Drive, Erganomic",0,$54.00,$5.00,2,Accessories
AZ-2013-4962412,"FUR-Sauder Stackable Bookrack, Pine",0.6,$239.00,-$131.00,4,Bookcases
AZ-2013-40070,"OFS-BIC Sketch Pad, Fluorescent",0,$349.00,$115.00,7,Art
AZ-2013-40070,"OFS-Binney & Smith Pencil Sharpener, Easy-Erase",0,$168.00,$18.00,6,Art
AZ-2013-40070,"OFS-Sanford Sketch Pad, Water Color",0,$97.00,$46.00,2,Art
AZ-2013-9496816,"OFS-Eldon Lockers, Industrial",0,$397.00,$194.00,2,Storage
BN-2013-6206755,"TECH-Hewlett Fax Machine, High-Speed",0.1,$573.00,$0.00,2,Copiers
AZ-2013-9718437,"FUR-Dania Classic Bookcase, Mobile",0.1,"$1,488.00",$132.00,4,Bookcases
AZ-2013-5987890,"OFS-BIC Pencil Sharpener, Water Color",0,$129.00,$49.00,4,Art
AZ-2013-5987890,"TECH-Panasonic Receipt Printer, Durable",0,$484.00,$213.00,4,Machines
AZ-2013-5900353,"OFS-Boston Pencil Sharpener, Easy-Erase",0,$181.00,$29.00,6,Art
AZ-2013-5900353,"OFS-Tenex Shelving, Wire Frame",0.1,$97.00,$2.00,2,Storage
AZ-2013-5900353,"TECH-Cisco Signal Booster, with Caller ID",0,"$1,063.00",$266.00,7,Phones
BN-2013-4461629,"OFS-Stanley Sketch Pad, Easy-Erase",0.5,$112.00,-$69.00,5,Art
BN-2013-4461629,"OFS-Wilson Jones Binder Covers, Recycled",0.5,$12.00,-$6.00,2,Binders
AZ-2013-4525210,"OFS-Kraft Interoffice Envelope, Recycled",0,$229.00,$75.00,5,Envelopes
AZ-2013-327406,"FUR-Bevis Wood Table, Rectangular",0.35,"$1,726.00",-$478.00,5,Tables
AZ-2013-5109758,"FUR-Office Star Chairmat, Adjustable",0,$205.00,$80.00,3,Chairs
AZ-2013-327406,"OFS-Binney & Smith Canvas, Blue",0,$154.00,$29.00,3,Art
AZ-2013-327406,"OFS-Cardinal 3-Hole Punch, Durable",0,$61.00,$28.00,2,Binders
AZ-2013-327406,"TECH-Canon Fax and Copier, Color",0,$578.00,$139.00,3,Copiers
AZ-2013-327406,"TECH-Hewlett Wireless Fax, Digital",0,"$1,899.00",$228.00,5,Copiers
AZ-2013-3145442,"TECH-Brother Personal Copier, Digital",0,$143.00,$3.00,1,Copiers
AZ-2013-6437122,"OFS-Boston Highlighters, Fluorescent",0,$60.00,$16.00,3,Art
AZ-2013-6437122,"OFS-Tenex Box, Blue",0.1,$45.00,$7.00,3,Storage
BN-2013-893797,"TECH-Canon Copy Machine, Digital",0.5,$393.00,-$306.00,3,Copiers
AZ-2013-267160,"OFS-BIC Canvas, Blue",0,$269.00,$21.00,5,Art
AZ-2013-267160,"OFS-Boston Sketch Pad, Blue",0,$194.00,$84.00,4,Art
AZ-2013-7607694,"OFS-Boston Canvas, Fluorescent",0,$165.00,$30.00,3,Art
AZ-2013-7607694,"OFS-Avery Index Tab, Durable",0,$20.00,$5.00,3,Binders
AZ-2013-267160,"TECH-Memorex Mouse, Bluetooth",0,$85.00,$3.00,3,Accessories
AZ-2013-267160,"TECH-Cisco Headset, Full Size",0,$628.00,$213.00,7,Phones
BN-2013-2967589,"FUR-Bush 3-Shelf Cabinet, Traditional",0.1,$129.00,$17.00,1,Bookcases
BN-2013-2967589,"OFS-Novimex Color Coded Labels, Adjustable",0,$10.00,$5.00,1,Labels
BN-2013-2967589,"OFS-Smead Legal Exhibit Labels, Adjustable",0,$9.00,$1.00,1,Labels
BN-2013-2967589,"OFS-Xerox Parchment Paper, Premium",0,$40.00,$13.00,3,Paper
BN-2013-2967589,"OFS-Tenex Trays, Wire Frame",0.1,$240.00,$107.00,5,Storage
AZ-2013-6538,"OFS-Sanford Pencil Sharpener, Fluorescent",0,$207.00,$72.00,8,Art
BN-2013-2967589,"TECH-Motorola Smart Phone, Full Size",0,"$2,571.00",$977.00,4,Phones
AZ-2013-6514734,"OFS-Wilson Jones 3-Hole Punch, Durable",0,$147.00,$31.00,5,Binders
AZ-2013-2169586,"TECH-HP Wireless Fax, Color",0,"$1,085.00",$11.00,3,Copiers
AZ-2013-4243411,"OFS-Tenex Folders, Blue",0.1,$84.00,$21.00,4,Storage
BN-2013-7163179,"FUR-Novimex Executive Leather Armchair, Red",0.5,$920.00,-$276.00,4,Chairs
BN-2013-7163179,"OFS-GlobeWeis Business Envelopes, Set of 50",0.5,$26.00,-$12.00,3,Envelopes
BN-2013-7163179,"OFS-Smead Box, Blue",0.5,$16.00,-$16.00,3,Storage
BN-2013-7163179,"TECH-Belkin Keyboard, Programmable",0.5,$299.00,-$197.00,7,Accessories
BN-2013-804810,"OFS-SanDisk Parchment Paper, Multicolor",0.5,$54.00,-$33.00,6,Paper
BN-2013-804810,"OFS-Fiskars Scissors, Easy Grip",0.5,$74.00,-$57.00,6,Supplies
AZ-2013-6362222,"OFS-Cardinal Binding Machine, Economy",0.1,$179.00,$36.00,4,Binders
AZ-2013-6362222,"OFS-Ibico 3-Hole Punch, Recycled",0.1,$55.00,$11.00,2,Binders
AZ-2013-6362222,"OFS-Eldon Folders, Industrial",0.1,$79.00,-$6.00,5,Storage
AZ-2013-6362222,"TECH-Nokia Signal Booster, VoIP",0.1,$738.00,$147.00,6,Phones
AZ-2013-4345897,"OFS-Accos Rubber Bands, Metal",0.1,$15.00,$5.00,1,Fasteners
AZ-2013-4345897,"OFS-Eldon Trays, Single Width",0.2,$77.00,$12.00,2,Storage
AZ-2013-5013285,"OFS-GlobeWeis Peel and Seal, with clear poly window",0,$75.00,$4.00,3,Envelopes
AZ-2013-8108569,"OFS-Binney & Smith Pencil Sharpener, Water Color",0,$135.00,$62.00,5,Art
AZ-2013-5013285,"TECH-Cisco Office Telephone, Full Size",0,$409.00,$78.00,5,Phones
AZ-2013-5098610,"OFS-Ames Peel and Seal, Recycled",0,$52.00,$18.00,3,Envelopes
AZ-2013-5098610,"TECH-Canon Fax Machine, Digital",0,$636.00,$146.00,2,Copiers
AZ-2013-5944136,"FUR-Eldon Photo Frame, Duo Pack",0,$116.00,$7.00,2,Furnishings
AZ-2013-8122695,"OFS-Breville Refrigerator, Black",0,"$2,594.00","$1,141.00",5,Appliances
AZ-2013-8122695,"OFS-Avery Binding Machine, Economy",0,$342.00,$41.00,7,Binders
AZ-2013-1203814,"TECH-StarTech Card Printer, White",0.1,$437.00,$29.00,3,Machines
AZ-2013-9080857,"OFS-Eaton Memo Slips, Multicolor",0,$106.00,$18.00,7,Paper
AZ-2013-6301171,"OFS-Cameo Mailers, Recycled",0,$259.00,$59.00,7,Envelopes
AZ-2013-588025,"FUR-Deflect-O Door Stop, Durable",0,$123.00,$17.00,3,Furnishings
AZ-2013-588025,"OFS-Boston Pencil Sharpener, Water Color",0,$193.00,$96.00,6,Art
AZ-2013-5864378,"OFS-BIC Markers, Fluorescent",0,$166.00,$13.00,6,Art
AZ-2013-5864378,"OFS-BIC Pens, Easy-Erase",0,$15.00,$3.00,1,Art
BN-2013-2755077,"OFS-Wilson Jones Binding Machine, Durable",0,$50.00,$1.00,1,Binders
BN-2013-2755077,"OFS-Xerox Note Cards, Multicolor",0,$83.00,$21.00,3,Paper
BN-2013-2755077,"OFS-Rogers Shelving, Single Width",0.1,$448.00,-$10.00,8,Storage
BN-2013-2755077,"TECH-Samsung Smart Phone, VoIP",0.1,"$5,726.00",-$445.00,10,Phones
BN-2013-5868311,"FUR-Advantus Light Bulb, Erganomic",0.2,$45.00,-$6.00,3,Furnishings
BN-2013-5868311,"FUR-Tenex Light Bulb, Black",0.2,$30.00,$4.00,2,Furnishings
BN-2013-6003171,"FUR-Harbour Creations Bag Chairs, Adjustable",0.5,$96.00,-$8.00,3,Chairs
BN-2013-6003171,"FUR-Advantus Light Bulb, Black",0.6,$24.00,-$8.00,3,Furnishings
BN-2013-5868311,"OFS-Ibico Binding Machine, Recycled",0.5,$259.00,-$166.00,10,Binders
BN-2013-8437019,"OFS-Kraft Peel and Seal, Security-Tint",0,$69.00,$11.00,3,Envelopes
BN-2013-6003171,"OFS-Avery Binding Machine, Durable",0.5,$101.00,-$89.00,4,Binders
BN-2013-6003171,"OFS-Cameo Peel and Seal, Recycled",0.5,$30.00,-$16.00,3,Envelopes
AZ-2013-9283365,"TECH-HP Wireless Fax, Digital",0.15,"$2,753.00",$842.00,9,Copiers
BN-2013-8437019,"TECH-Enermax Memory Card, Programmable",0,$348.00,$66.00,3,Accessories
BN-2013-8437019,"TECH-Epson Inkjet, Durable",0,"$1,533.00",$506.00,5,Machines
BN-2013-6003171,"TECH-Enermax Memory Card, Erganomic",0.5,$224.00,-$14.00,4,Accessories
BN-2013-6003171,"TECH-Motorola Office Telephone, VoIP",0.5,$108.00,-$13.00,3,Phones
BN-2013-397330,"TECH-Okidata Card Printer, Durable",0.15,$598.00,-$49.00,4,Machines
BN-2013-9125930,"FUR-Dania 3-Shelf Cabinet, Pine",0.5,$71.00,-$59.00,1,Bookcases
BN-2013-9125930,"OFS-Xerox Note Cards, Recycled",0.5,$39.00,-$24.00,3,Paper
AZ-2013-971860,"OFS-Sanford Markers, Fluorescent",0,$98.00,$39.00,4,Art
AZ-2013-3923092,"OFS-Boston Pens, Water Color",0,$52.00,$5.00,3,Art
AZ-2013-9453292,"OFS-Cuisinart Blender, White",0,$261.00,$99.00,4,Appliances
AZ-2013-9453292,"TECH-Okidata Receipt Printer, Durable",0,$615.00,$25.00,5,Machines
AZ-2013-706916,"OFS-Elite Letter Opener, High Speed",0,$53.00,$22.00,2,Supplies
AZ-2013-2465655,"OFS-Avery 3-Hole Punch, Recycled",0,$85.00,$0.00,3,Binders
BN-2013-48132,"FUR-Hon Executive Leather Armchair, Red",0.2,$735.00,-$184.00,2,Chairs
AZ-2013-4775573,"OFS-Stanley Markers, Easy-Erase",0,$45.00,$0.00,2,Art
AZ-2013-4775573,"OFS-GlobeWeis Clasp Envelope, with clear poly window",0,$13.00,$5.00,1,Envelopes
AZ-2013-4775573,"OFS-Fiskars Ruler, High Speed",0,$29.00,$0.00,2,Supplies
AZ-2013-9231004,"OFS-Ibico Binder, Clear",0,$45.00,$4.00,3,Binders
AZ-2013-5022500,"OFS-BIC Pencil Sharpener, Fluorescent",0,$212.00,$72.00,7,Art
AZ-2013-5022500,"OFS-Binney & Smith Markers, Fluorescent",0,$76.00,$21.00,3,Art
AZ-2013-6415803,"OFS-Eldon Trays, Blue",0.1,$173.00,$15.00,4,Storage
AZ-2013-3807660,"OFS-Elite Scissors, Easy Grip",0,$24.00,$11.00,1,Supplies
AZ-2013-5022500,"TECH-Logitech Numeric Keypad, Bluetooth",0,$278.00,$42.00,6,Accessories
AZ-2013-7749449,"OFS-Enermax Note Cards, Multicolor",0,$98.00,$21.00,3,Paper
BN-2013-583958,"FUR-Bevis Training Table, Adjustable Height",0.35,"$1,096.00",-$422.00,5,Tables
AZ-2013-4637331,"OFS-Green Bar Note Cards, Multicolor",0,$34.00,$14.00,1,Paper
AZ-2013-7626927,"FUR-Eldon Door Stop, Black",0,$602.00,$114.00,12,Furnishings
AZ-2013-7626927,"OFS-Boston Sketch Pad, Fluorescent",0,$648.00,$0.00,13,Art
AZ-2013-7626927,"OFS-Cardinal Binder Covers, Clear",0,$34.00,$9.00,3,Binders
AZ-2013-7626927,"TECH-Apple Speaker Phone, with Caller ID",0.15,$734.00,$86.00,7,Phones
AZ-2013-125479,"FUR-Harbour Creations Steel Folding Chair, Red",0.1,$264.00,$50.00,3,Chairs
AZ-2013-125479,"FUR-Tenex Light Bulb, Erganomic",0,$18.00,$1.00,1,Furnishings
AZ-2013-125479,"OFS-GlobeWeis Peel and Seal, Set of 50",0,$43.00,$0.00,2,Envelopes
AZ-2013-3367178,"OFS-Sanford Markers, Water Color",0,$370.00,$33.00,14,Art
AZ-2013-8617478,"FUR-Novimex Chairmat, Red",0,$225.00,$68.00,4,Chairs
AZ-2013-8617478,"OFS-Avery Legal Exhibit Labels, Laser Printer Compatible",0,$11.00,$2.00,1,Labels
AZ-2013-9258078,"OFS-Binney & Smith Pens, Easy-Erase",0.5,$24.00,-$24.00,4,Art
AZ-2013-9673280,"OFS-Binney & Smith Sketch Pad, Easy-Erase",0,$186.00,$28.00,4,Art
BN-2013-9375572,"OFS-Hoover Stove, White",0.5,"$3,400.00","-$3,060.00",12,Appliances
AZ-2013-8057502,"TECH-Hewlett Copy Machine, Laser",0,"$1,580.00",$32.00,6,Copiers
AZ-2013-3627184,"OFS-Xerox Message Books, Recycled",0,$61.00,$19.00,3,Paper
AZ-2013-7994697,"OFS-Boston Pens, Fluorescent",0,$31.00,$5.00,2,Art
AZ-2013-7994697,"TECH-Canon Fax Machine, Digital",0,$954.00,$219.00,3,Copiers
AZ-2013-360970,"OFS-Harbour Creations File Folder Labels, Laser Printer Compatible",0,$70.00,$22.00,8,Labels
AZ-2013-3156209,"FUR-Deflect-O Frame, Black",0.3,$231.00,$46.00,3,Furnishings
AZ-2013-3156209,"OFS-Binney & Smith Markers, Fluorescent",0,$127.00,$34.00,5,Art
AZ-2013-3156209,"OFS-Acco Hole Reinforcements, Clear",0,$12.00,$0.00,2,Binders
AZ-2013-3156209,"OFS-Green Bar Parchment Paper, 8.5 x 11",0,$104.00,$43.00,5,Paper
AZ-2013-699098,"TECH-Nokia Smart Phone, Cordless",0.15,"$1,622.00",$324.00,3,Phones
AZ-2013-4362020,"OFS-Avery Binder Covers, Clear",0,$63.00,$14.00,6,Binders
AZ-2013-3983168,"FUR-Hon Bag Chairs, Set of Two",0.5,$71.00,-$54.00,3,Chairs
BN-2013-2153787,"FUR-Advantus Light Bulb, Black",0.6,$72.00,-$24.00,9,Furnishings
AZ-2013-3983168,"OFS-Avery 3-Hole Punch, Durable",0.5,$88.00,-$27.00,6,Binders
AZ-2013-3983168,"OFS-Wilson Jones Binding Machine, Durable",0.5,$126.00,-$121.00,5,Binders
AZ-2013-3983168,"OFS-GlobeWeis Manila Envelope, Set of 50",0.5,$27.00,-$9.00,2,Envelopes
BN-2013-2153787,"OFS-Harbour Creations Color Coded Labels, 5000 Label Set",0.5,$20.00,-$1.00,3,Labels
AZ-2013-3983168,"TECH-Konica Card Printer, Wireless",0.5,$613.00,-$343.00,7,Machines
AZ-2013-2134224,"FUR-Dania Floating Shelf Set, Metal",0.1,$152.00,$47.00,1,Bookcases
AZ-2013-2134224,"OFS-Fellowes Box, Blue",0.1,$124.00,$8.00,7,Storage
AZ-2013-9907,"FUR-Eldon Light Bulb, Black",0,$50.00,$19.00,2,Furnishings
AZ-2013-9907,"OFS-Sanford Markers, Blue",0,$93.00,$18.00,4,Art
AZ-2013-9907,"OFS-Ames Interoffice Envelope, Recycled",0,$132.00,$59.00,3,Envelopes
AZ-2013-6711717,"FUR-Deflect-O Frame, Durable",0,$214.00,$88.00,2,Furnishings
AZ-2013-6711717,"OFS-BIC Markers, Blue",0,$132.00,$3.00,5,Art
AZ-2013-6711717,"OFS-Boston Markers, Blue",0,$79.00,$32.00,3,Art
AZ-2013-3088636,"OFS-Binney & Smith Highlighters, Fluorescent",0,$36.00,$3.00,2,Art
AZ-2013-9938365,"FUR-Rubbermaid Photo Frame, Erganomic",0,$101.00,$31.00,2,Furnishings
AZ-2013-9827479,"OFS-Green Bar Cards & Envelopes, 8.5 x 11",0,$105.00,$19.00,2,Paper
AZ-2013-2678161,"OFS-Avery Index Tab, Durable",0,$33.00,$9.00,5,Binders
AZ-2013-2678161,"OFS-Fiskars Scissors, High Speed",0,$116.00,$56.00,5,Supplies
AZ-2013-7710840,"OFS-Binney & Smith Pens, Water Color",0,$30.00,$11.00,2,Art
AZ-2013-7710840,"OFS-Avery Binder Covers, Clear",0,$11.00,$2.00,1,Binders
BN-2013-6837899,"OFS-Cuisinart Coffee Grinder, White",0.1,$165.00,$57.00,5,Appliances
BN-2013-6837899,"OFS-Wilson Jones Binding Machine, Recycled",0,$49.00,$5.00,1,Binders
BN-2013-6837899,"OFS-Stockwell Staples, Bulk Pack",0,$31.00,$13.00,3,Fasteners
BN-2013-6837899,"OFS-Kleencut Ruler, Serrated",0,$41.00,$10.00,4,Supplies
BN-2013-441704,"FUR-Sauder Library with Doors, Metal",0.5,$581.00,-$198.00,3,Bookcases
BN-2013-441704,"FUR-Advantus Photo Frame, Durable",0.2,$120.00,-$6.00,3,Furnishings
BN-2013-441704,"FUR-Tenex Photo Frame, Duo Pack",0.2,$249.00,$84.00,6,Furnishings
AZ-2013-6802973,"OFS-Hamilton Beach Refrigerator, Black",0.1,$899.00,$80.00,2,Appliances
BN-2013-441704,"OFS-BIC Canvas, Fluorescent",0.5,$137.00,-$41.00,5,Art
BN-2013-441704,"OFS-Sanford Pens, Blue",0.5,$11.00,-$6.00,2,Art
BN-2013-441704,"OFS-Cardinal Binder Covers, Economy",0.5,$12.00,-$11.00,2,Binders
AZ-2013-9545933,"OFS-Sanford Pens, Easy-Erase",0,$34.00,$8.00,3,Art
BN-2013-441704,"TECH-Logitech Keyboard, Bluetooth",0.5,$72.00,-$58.00,2,Accessories
AZ-2013-3483098,"FUR-Harbour Creations Chairmat, Black",0,$278.00,$58.00,4,Chairs
AZ-2013-3483098,"OFS-Cameo Peel and Seal, with clear poly window",0,$74.00,$32.00,3,Envelopes
AZ-2013-3483098,"TECH-Cisco Signal Booster, Full Size",0,$153.00,$5.00,1,Phones
AZ-2013-4468276,"OFS-BIC Pencil Sharpener, Fluorescent",0,$242.00,$82.00,8,Art
AZ-2013-6138648,"FUR-Office Star Rocking Chair, Adjustable",0.1,"$1,032.00",$298.00,8,Chairs
AZ-2013-6138648,"FUR-Rubbermaid Photo Frame, Erganomic",0,$151.00,$47.00,3,Furnishings
AZ-2013-6138648,"OFS-Binney & Smith Sketch Pad, Blue",0,$185.00,$48.00,4,Art
AZ-2013-2709620,"OFS-Binney & Smith Markers, Fluorescent",0,$76.00,$21.00,3,Art
BN-2013-7934159,"OFS-Tenex File Cart, Single Width",0.1,$362.00,-$4.00,3,Storage
AZ-2013-5637964,"OFS-Acco Binder Covers, Durable",0,$44.00,$20.00,3,Binders
AZ-2013-5637964,"OFS-Wilson Jones 3-Hole Punch, Economy",0,$84.00,$28.00,3,Binders
AZ-2013-5637964,"OFS-Wilson Jones 3-Hole Punch, Economy",0,$84.00,$28.00,3,Binders
AZ-2013-2709620,"TECH-Belkin Mouse, Erganomic",0,$347.00,$59.00,9,Accessories
AZ-2013-5637964,"TECH-Enermax Router, Programmable",0,"$2,079.00",$852.00,8,Accessories
AZ-2013-5637964,"TECH-Hewlett Wireless Fax, Laser",0,$760.00,$236.00,2,Copiers
AZ-2013-6548311,"FUR-Bush Stackable Bookrack, Traditional",0,$369.00,$92.00,3,Bookcases
AZ-2013-6548311,"OFS-Acco 3-Hole Punch, Recycled",0,$213.00,$19.00,7,Binders
AZ-2013-6548311,"OFS-Cameo Interoffice Envelope, Security-Tint",0,$100.00,$10.00,2,Envelopes
AZ-2013-1146430,"OFS-Binney & Smith Sketch Pad, Water Color",0.1,$178.00,$45.00,4,Art
AZ-2013-1146430,"TECH-Epson Card Printer, Durable",0.1,"$1,071.00",$286.00,7,Machines
AZ-2013-1146430,"TECH-Okidata Calculator, White",0.1,$137.00,-$12.00,3,Machines
AZ-2013-8774500,"FUR-Novimex Executive Leather Armchair, Red",0.1,"$1,243.00",$345.00,3,Chairs
AZ-2013-8774500,"OFS-Fellowes Box, Blue",0.1,$53.00,$3.00,3,Storage
AZ-2013-8774500,"TECH-Logitech Router, Programmable",0,"$1,244.00",$448.00,5,Accessories
AZ-2013-8795323,"OFS-Wilson Jones Index Tab, Economy",0,$58.00,$15.00,9,Binders
AZ-2013-7006119,"OFS-Stanley Sketch Pad, Fluorescent",0,$91.00,$15.00,2,Art
AZ-2013-8795323,"TECH-Belkin Numeric Keypad, Erganomic",0,$59.00,$1.00,1,Accessories
AZ-2013-8795323,"TECH-Enermax Flash Drive, USB",0,$334.00,$130.00,8,Accessories
AZ-2013-6244362,"TECH-Nokia Headset, with Caller ID",0,$292.00,$35.00,4,Phones
AZ-2013-7006119,"TECH-HP Fax Machine, Laser",0,"$1,200.00",$480.00,4,Copiers
AZ-2013-3352012,"FUR-Deflect-O Frame, Durable",0,$428.00,$176.00,4,Furnishings
AZ-2013-3352012,"OFS-Boston Pens, Easy-Erase",0,$29.00,$10.00,2,Art
AZ-2013-3352012,"OFS-Ibico Binder, Durable",0,$34.00,$1.00,2,Binders
AZ-2013-3352012,"OFS-Eldon Trays, Blue",0,$240.00,$43.00,5,Storage
BN-2013-4285479,"OFS-Fellowes Box, Single Width",0.1,$53.00,-$2.00,3,Storage
AZ-2013-3352012,"TECH-StarTech Phone, Wireless",0,$298.00,$24.00,4,Machines
BN-2013-4285479,"TECH-Sharp Personal Copier, Digital",0,$598.00,$299.00,5,Copiers
AZ-2013-8633659,"FUR-Deflect-O Door Stop, Duo Pack",0,$264.00,$95.00,6,Furnishings
AZ-2013-8633659,"OFS-Boston Sketch Pad, Fluorescent",0,$150.00,$0.00,3,Art
BN-2013-5104816,"OFS-Fellowes Box, Blue",0.4,$47.00,-$19.00,4,Storage
AZ-2013-343563,"OFS-Advantus Rubber Bands, 12 Pack",0,$48.00,$13.00,3,Fasteners
AZ-2013-7431618,"FUR-Bush 3-Shelf Cabinet, Mobile",0.1,$263.00,$15.00,2,Bookcases
AZ-2013-7431618,"OFS-Stiletto Ruler, Steel",0,$43.00,$21.00,3,Supplies
AZ-2013-8367272,"TECH-Belkin Memory Card, Programmable",0,$582.00,$174.00,5,Accessories
AZ-2013-6053610,"FUR-Advantus Photo Frame, Duo Pack",0,$159.00,$60.00,3,Furnishings
AZ-2013-6053610,"OFS-Stockwell Staples, Assorted Sizes",0,$25.00,$11.00,3,Fasteners
AZ-2013-5974172,"TECH-Canon Personal Copier, High-Speed",0.65,$592.00,-$643.00,12,Copiers
AZ-2013-4874809,"FUR-Chromcraft Conference Table, with Bottom Storage",0,$873.00,$61.00,1,Tables
AZ-2013-4874809,"OFS-Stanley Pens, Blue",0,$40.00,$20.00,4,Art
AZ-2013-4874809,"OFS-Cardinal Binder Covers, Economy",0,$48.00,$2.00,4,Binders
AZ-2013-8131512,"OFS-BIC Pens, Easy-Erase",0,$102.00,$22.00,7,Art
BN-2013-5022236,"OFS-Avery Binder, Clear",0.5,$49.00,-$40.00,8,Binders
BN-2013-5022236,"OFS-Cardinal Index Tab, Clear",0.5,$7.00,-$2.00,2,Binders
BN-2013-5022236,"OFS-Eaton Computer Printout Paper, Multicolor",0.5,$14.00,-$10.00,1,Paper
AZ-2013-2582964,"OFS-BIC Sketch Pad, Water Color",0,$52.00,$8.00,1,Art
AZ-2013-5337437,"OFS-BIC Sketch Pad, Fluorescent",0,$100.00,$33.00,2,Art
AZ-2013-5337437,"OFS-Kleencut Box Cutter, Steel",0,$136.00,$22.00,4,Supplies
AZ-2013-5337437,"TECH-Nokia Headset, with Caller ID",0.4,$132.00,-$61.00,3,Phones
AZ-2013-4627833,"FUR-Sauder Library with Doors, Pine",0,$778.00,$62.00,2,Bookcases
AZ-2013-4627833,"FUR-Lesro Round Table, Rectangular",0,$899.00,$396.00,2,Tables
AZ-2013-4627833,"OFS-Cardinal Index Tab, Clear",0,$27.00,$11.00,4,Binders
AZ-2013-649774,"FUR-Dania Floating Shelf Set, Metal",0,$506.00,$192.00,3,Bookcases
BN-2013-9068340,"OFS-Enermax Cards & Envelopes, 8.5 x 11",0.5,$77.00,-$63.00,3,Paper
BN-2013-9068340,"OFS-Elite Ruler, High Speed",0.5,$76.00,-$64.00,11,Supplies
AZ-2013-649774,"OFS-Acco Index Tab, Clear",0,$8.00,$3.00,1,Binders
AZ-2013-649774,"TECH-Epson Receipt Printer, Red",0,$228.00,$114.00,2,Machines
BN-2013-2488199,"TECH-Hewlett Ink, Color",0.15,$383.00,-$5.00,3,Copiers
AZ-2013-1568579,"OFS-Fellowes Box, Wire Frame",0.1,$51.00,$20.00,3,Storage
AZ-2013-1568579,"TECH-Brother Fax and Copier, High-Speed",0.1,"$1,536.00",$171.00,9,Copiers
AZ-2013-4520943,"FUR-SAFCO Swivel Stool, Adjustable",0.2,$409.00,$143.00,3,Chairs
AZ-2013-4520943,"OFS-Avery Hole Reinforcements, Durable",0.1,$16.00,$5.00,3,Binders
BN-2013-5978762,"OFS-Smead Round Labels, Adjustable",0.5,$5.00,-$2.00,2,Labels
BN-2013-5978762,"OFS-Smead Trays, Single Width",0.5,$49.00,-$17.00,2,Storage
BN-2013-5978762,"TECH-HP Wireless Fax, High-Speed",0.5,$896.00,-$36.00,5,Copiers
BN-2013-1963418,"OFS-Ibico Hole Reinforcements, Clear",0,$6.00,$2.00,1,Binders
BN-2013-1963418,"OFS-Hon Shipping Labels, Alphabetical",0,$22.00,$10.00,2,Labels
AZ-2013-4878818,"OFS-GlobeWeis Clasp Envelope, Recycled",0,$26.00,$7.00,3,Envelopes
AZ-2013-4284308,"OFS-Fellowes Trays, Single Width",0.4,$69.00,$11.00,2,Storage
AZ-2013-2526896,"FUR-Rubbermaid Clock, Duo Pack",0,$251.00,$40.00,5,Furnishings
AZ-2013-2526896,"OFS-Enermax Computer Printout Paper, Multicolor",0,$149.00,$4.00,5,Paper
AZ-2013-2526896,"OFS-Tenex File Cart, Single Width",0,$269.00,$126.00,2,Storage
AZ-2013-2526896,"TECH-Hewlett Wireless Fax, Laser",0,"$3,422.00","$1,061.00",9,Copiers
AZ-2013-183270,"OFS-Boston Pencil Sharpener, Water Color",0,$58.00,$8.00,2,Art
AZ-2013-183270,"OFS-Green Bar Parchment Paper, Premium",0,$33.00,$1.00,2,Paper
AZ-2013-9549607,"FUR-Advantus Frame, Erganomic",0,$439.00,$140.00,4,Furnishings
AZ-2013-9549607,"FUR-Rubbermaid Photo Frame, Durable",0,$146.00,$7.00,3,Furnishings
AZ-2013-9549607,"OFS-Avery Binder Covers, Economy",0,$44.00,$14.00,4,Binders
AZ-2013-6510557,"OFS-Fellowes Lockers, Industrial",0.4,$623.00,$41.00,5,Storage
AZ-2013-9485550,"FUR-Rubbermaid Clock, Durable",0.3,$99.00,$8.00,3,Furnishings
AZ-2013-9485550,"OFS-Cuisinart Microwave, Black",0,$278.00,$14.00,1,Appliances
AZ-2013-9591675,"FUR-Eldon Door Stop, Erganomic",0,$98.00,$13.00,2,Furnishings
AZ-2013-9591675,"FUR-Tenex Stacking Tray, Erganomic",0,$67.00,$30.00,3,Furnishings
AZ-2013-4330374,"FUR-Dania Stackable Bookrack, Pine",0,$492.00,$5.00,4,Bookcases
AZ-2013-4330374,"FUR-Bevis Computer Table, Fully Assembled",0.5,$989.00,-$435.00,4,Tables
AZ-2013-9591675,"OFS-OIC Thumb Tacks, 12 Pack",0,$41.00,$16.00,3,Fasteners
BN-2013-8532201,"OFS-Sanford Pencil Sharpener, Water Color",0,$29.00,$3.00,1,Art
